小池都知事 始球式で骨折 全治2か月 公務は当面リモートで	html/20240807/k10014540391000.html	Wed, 07 Aug 2024 16:16:06 +0900
フィギュアスケート団体 北京五輪 日本に銀メダルを授与	html/20240808/k10014541331000.html	Thu, 08 Aug 2024 03:19:56 +0900
埼玉 群馬 山梨で「記録的短時間大雨情報」厳重警戒を	html/20240807/k10014540751000.html	Wed, 07 Aug 2024 22:16:06 +0900
株価 一時1100円以上値上がり 日銀内田副総裁の発言受け	html/20240807/k10014539851000.html	Wed, 07 Aug 2024 19:02:24 +0900
山あいの一軒家で覚醒剤密造～日本に忍び寄る闇	html/20240807/k10014513031000.html	Wed, 07 Aug 2024 17:25:54 +0900
長崎市長 あすの平和祈念式典 イスラエル不招待について説明	html/20240808/k10014541441000.html	Thu, 08 Aug 2024 11:58:03 +0900
パリオリンピック【結果】8/7～8/8 タイムライン	html/20240807/k10014540461000.html	Thu, 08 Aug 2024 05:26:29 +0900
日清食品 小売店に販売価格値上げ要求 独占禁止法違反のおそれ	html/20240808/k10014541361000.html	Thu, 08 Aug 2024 12:02:16 +0900
レスリング 女子50キロ級 須崎優衣 銅メダル パリオリンピック	html/20240808/k10014540821000.html	Thu, 08 Aug 2024 10:31:39 +0900
大阪ミナミ 宝飾店強盗 刺された店員が死亡 中国籍の男を逮捕	html/20240807/k10014540281000.html	Wed, 07 Aug 2024 23:45:02 +0900
陸上 女子やり投げ予選 北口榛花と上田百寧 決勝進出 パリ五輪	html/20240807/k10014540791000.html	Wed, 07 Aug 2024 20:31:00 +0900
パリオリンピック メダルランキング 【8月6日】	html/20240807/k10014539741000.html	Wed, 07 Aug 2024 07:54:38 +0900
長崎 平和祈念式典に米駐日大使欠席へ イスラエル不招待受け	html/20240807/k10014540441000.html	Wed, 07 Aug 2024 17:05:39 +0900
パリオリンピック日程 8/7～8（競技・放送・配信予定）	html/20240807/k10014539561000.html	Wed, 07 Aug 2024 18:06:53 +0900
卓球 男子団体 準決勝 日本は逆転負け 3位決定戦へ パリ五輪	html/20240808/k10014541721000.html	Thu, 08 Aug 2024 10:40:47 +0900
陸上女子1500m 田中希実 準決勝進出 救済措置で パリ五輪	html/20240806/k10014539021000.html	Tue, 06 Aug 2024 22:42:54 +0900
原付きバイク ホンダとスズキ 生産終了を検討 国内生産終了へ	html/20240807/k10014539331000.html	Wed, 07 Aug 2024 00:05:56 +0900
レスリング 男子グレコ77キロ級 日下尚が金メダル パリ五輪	html/20240808/k10014540801000.html	Thu, 08 Aug 2024 14:02:10 +0900
フェンシング 日本代表が帰国 江村美咲「感謝を伝えたい」五輪	html/20240807/k10014540621000.html	Wed, 07 Aug 2024 19:57:02 +0900
卓球 女子団体 日本 準決勝進出 パリオリンピック	html/20240807/k10014539801000.html	Wed, 07 Aug 2024 06:35:46 +0900
