愛媛 今治 山林火災延焼続く 焼失面積は倍に「飛び火」警戒を	html/20250326/k10014760531000.html	Wed, 26 Mar 2025 20:47:23 +0900
兵庫県 斎藤知事 パワハラ認め謝罪 県の対応は「適切だった」	html/20250326/k10014760651000.html	Wed, 26 Mar 2025 20:14:17 +0900
東北新幹線 強風で約8時間運転見合わせ 7万6000人余に影響	html/20250326/k10014760681000.html	Wed, 26 Mar 2025 22:04:41 +0900
宮崎 山林火災 ほぼ消し止め延焼おそれなくなる 避難指示 解除	html/20250326/k10014760571000.html	Wed, 26 Mar 2025 19:11:08 +0900
岡山 山林火災4日目 鎮圧めど立たず 延焼範囲546haで最大規模	html/20250326/k10014760581000.html	Wed, 26 Mar 2025 18:55:22 +0900
東北で強風 各地でけが人 宮城 白石で最大瞬間風速35m観測	html/20250326/k10014760821000.html	Wed, 26 Mar 2025 18:13:11 +0900
山林火災はなぜ起こる？半数超が2月から4月に集中 注意を	html/20250326/k10014760841000.html	Wed, 26 Mar 2025 14:42:31 +0900
ロシア・ウクライナと黒海の安全航行確保で合意 米政府発表	html/20250326/k10014760491000.html	Wed, 26 Mar 2025 11:41:35 +0900
愛媛 山林火災 避難指示拡大 今治市ほぼ全域で停電のおそれも	html/20250325/k10014759391000.html	Tue, 25 Mar 2025 21:24:24 +0900
福島 須賀川の山林火災 火は消し止められる けが人なし	html/20250326/k10014760851000.html	Wed, 26 Mar 2025 13:02:50 +0900
6年ぶりに開催 宮中晩さん会	html/20250324/k10014755951000.html	Mon, 24 Mar 2025 19:30:03 +0900
韓国 相次ぐ山火事 これまでの死者 計18人に	html/20250326/k10014760601000.html	Wed, 26 Mar 2025 10:30:59 +0900
浜松 小学生姉妹死傷事故 78歳の運転手“事故当時の記憶ない”	html/20250324/k10014759041000.html	Tue, 25 Mar 2025 18:59:51 +0900
高校野球 センバツ ベスト8出そろう 準々決勝の組み合わせは	html/20250325/k10014760091000.html	Tue, 25 Mar 2025 20:00:24 +0900
備蓄米 飲食店では？店頭販売は？2回目の入札始まる	html/20250326/k10014760661000.html	Wed, 26 Mar 2025 17:14:30 +0900
高校野球 センバツ【準々決勝の見どころ】	html/20250326/k10014760461000.html	Wed, 26 Mar 2025 06:29:14 +0900
このままでいいのか…でも ミドルシニア3人が語る「壁」とは？	html/20250325/k10014759641000.html	Tue, 25 Mar 2025 18:15:50 +0900
岡山の山林火災 鎮圧めど立たず 岡山市と玉野市に避難指示	html/20250325/k10014759341000.html	Tue, 25 Mar 2025 20:36:10 +0900
旧統一教会に解散命令 東京地裁 経緯は 今後の手続きは	html/20250325/k10014759591000.html	Tue, 25 Mar 2025 22:03:15 +0900
トランプ大統領 正式発表前に“自動車関税のプロセスを開始”	html/20250327/k10014761851000.html	Thu, 27 Mar 2025 05:50:47 +0900
