北海道沖 千島海溝 巨大地震起こしうる程度までひずみ蓄積か	html/20250309/k10014744431000.html	Sun, 09 Mar 2025 18:20:33 +0900
“ありがとう”メッセージ掲げ続けた福島の少年はいま…	html/20250309/k10014742361000.html	Sun, 09 Mar 2025 11:06:18 +0900
岩手 大船渡の山林火災 市が鎮圧宣言 発生から11日	html/20250309/k10014744381000.html	Sun, 09 Mar 2025 19:11:05 +0900
＃私が退職した本当の理由 胸にしまい込んできた その思いは	html/20250308/k10014742341000.html	Sat, 08 Mar 2025 18:52:34 +0900
上昇が止まらない【経済コラム】	html/20250307/k10014741411000.html	Sun, 09 Mar 2025 07:16:39 +0900
大相撲春場所初日 新横綱の豊昇龍 阿炎に敗れる	html/20250309/k10014744231000.html	Sun, 09 Mar 2025 20:13:36 +0900
津波からの「避難困難地域」に10万人超える住民 宮城県だけで	html/20250309/k10014744071000.html	Sun, 09 Mar 2025 16:04:56 +0900
ダウンタウン浜田雅功さん 体調不良で一時休養 所属事務所発表	html/20250310/k10014744951000.html	Mon, 10 Mar 2025 11:50:53 +0900
【速報中】岩手 大船渡の山林火災 避難指示すべて解除	html/20250310/k10014744751000.html	Mon, 10 Mar 2025 13:14:07 +0900
将棋「王将戦」第5局 藤井聡太七冠がタイトル防衛 4連覇果たす	html/20250309/k10014744561000.html	Sun, 09 Mar 2025 20:19:05 +0900
女子マラソン 佐藤早也伽 日本歴代9位の2時間20分59秒	html/20250309/k10014744301000.html	Sun, 09 Mar 2025 12:49:52 +0900
未知なる高みを目指した登山家 平出和也 中島健郎	html/20241224/k10014676521000.html	Tue, 24 Dec 2024 16:12:58 +0900
カナダ カーニー氏首相就任へ 関税措置圧力強める米に対抗姿勢	html/20250310/k10014744691000.html	Mon, 10 Mar 2025 12:24:47 +0900
高校無償化どうなる？大阪は公立離れ 東京は中学受験“熱”も	html/20250309/k10014744261000.html	Sun, 09 Mar 2025 16:51:47 +0900
大相撲春場所 三段目 朝乃山が本場所の土俵に 復帰戦白星飾る	html/20250309/k10014744341000.html	Sun, 09 Mar 2025 15:15:47 +0900
あなたのまちの図書館は？進化か衰退か… 岐路に立つ読書文化	html/20250308/k10014740851000.html	Sat, 08 Mar 2025 17:37:26 +0900
大船渡 山林火災 赤崎町4地区で避難指示解除 残り火の消火続く	html/20250309/k10014743961000.html	Sun, 09 Mar 2025 18:05:27 +0900
倍率1万6000倍？中国若者殺到する“体制内”とは？	html/20250307/k10014742781000.html	Fri, 07 Mar 2025 20:08:09 +0900
年収の壁どうなった？詳しく解説	html/20250307/k10014741421000.html	Fri, 07 Mar 2025 17:15:55 +0900
米でトランプ政権にウクライナへ軍事支援 再開など求める集会	html/20250309/k10014744151000.html	Sun, 09 Mar 2025 10:02:57 +0900
