愛媛 今治 山林火災延焼続く 焼失面積は倍に「飛び火」警戒を	html/20250326/k10014760531000.html	Wed, 26 Mar 2025 20:47:23 +0900
兵庫県 斎藤知事 パワハラ認め謝罪 県の対応は「適切だった」	html/20250326/k10014760651000.html	Wed, 26 Mar 2025 20:14:17 +0900
トランプ氏 25％の自動車関税署名 日本車も対象 国内影響は？	html/20250327/k10014761851000.html	Thu, 27 Mar 2025 13:05:04 +0900
愛媛 今治 山林火災5日目 延焼続く 27日夜 まとまった雨の予想	html/20250327/k10014761811000.html	Thu, 27 Mar 2025 12:08:41 +0900
山林火災はなぜ起こる？半数超が2月から4月に集中 注意を	html/20250326/k10014760841000.html	Wed, 26 Mar 2025 14:42:31 +0900
東北新幹線 強風で約8時間運転見合わせ 7万6000人余に影響	html/20250326/k10014760681000.html	Wed, 26 Mar 2025 22:04:41 +0900
岡山 山林火災4日目 鎮圧めど立たず 延焼範囲546haで最大規模	html/20250326/k10014760581000.html	Wed, 26 Mar 2025 18:55:22 +0900
岡山 山林火災5日目 延焼範囲約559ha 最大規模 鎮圧めど立たず	html/20250327/k10014761791000.html	Thu, 27 Mar 2025 12:31:15 +0900
東北で強風 各地でけが人 宮城 白石で最大瞬間風速35m観測	html/20250326/k10014760821000.html	Wed, 26 Mar 2025 18:13:11 +0900
年収3000万円以下は学費タダ？世界トップ大学の戦略は？	html/20250326/k10014761231000.html	Wed, 26 Mar 2025 20:38:34 +0900
高校野球 センバツ ベスト4出そろう 準決勝の対戦カードは	html/20250326/k10014761541000.html	Wed, 26 Mar 2025 21:29:30 +0900
宮崎 山林火災 ほぼ消し止め延焼おそれなくなる 避難指示 解除	html/20250326/k10014760571000.html	Wed, 26 Mar 2025 19:11:08 +0900
福島 須賀川の山林火災 火は消し止められる けが人なし	html/20250326/k10014760851000.html	Wed, 26 Mar 2025 13:02:50 +0900
ジャングルポケット 斉藤元メンバー在宅起訴 女性に性的暴行罪	html/20250326/k10014761291000.html	Wed, 26 Mar 2025 18:10:28 +0900
トランプ大統領 “自動車関税”を正式表明 日本も対象	html/20250327/k10014761881000.html	Thu, 27 Mar 2025 06:41:41 +0900
韓国 相次ぐ山火事で23人死亡確認 消火作業のヘリ墜落で死者も	html/20250326/k10014761251000.html	Wed, 26 Mar 2025 19:06:02 +0900
フィギュア世界選手権 坂本花織5位 千葉2位 女子シングルSP	html/20250327/k10014761911000.html	Thu, 27 Mar 2025 08:11:40 +0900
「d払い」復旧 一時全国の店舗で決済が利用できず 設備故障か	html/20250326/k10014761501000.html	Wed, 26 Mar 2025 20:55:43 +0900
浜松 小学生死傷事故 運転手“過去にも気づいたら事故”供述	html/20250327/k10014761721000.html	Thu, 27 Mar 2025 05:00:02 +0900
父の死に関わった元信者からの28通の手紙 オウム真理教事件	html/20250326/k10014759021000.html	Wed, 26 Mar 2025 19:49:10 +0900
