C-C-B 元メンバー 覚醒剤取締法違反の罪で逮捕 起訴	html/20240801/k10014532401000.html	Thu, 01 Aug 2024 11:43:47 +0900
パリオリンピック【結果】8/1～8/2タイムライン	html/20240801/k10014533071000.html	Fri, 02 Aug 2024 08:27:09 +0900
卓球 女子シングルス 平野美宇 準々決勝敗退 パリオリンピック	html/20240801/k10014533171000.html	Thu, 01 Aug 2024 22:39:47 +0900
フェンシング 女子フルーレ団体 日本が銅メダル パリ五輪	html/20240802/k10014533501000.html	Fri, 02 Aug 2024 07:22:48 +0900
“ハリス氏はインド系から突然黒人に”トランプ氏の発言で波紋	html/20240801/k10014532601000.html	Thu, 01 Aug 2024 14:01:35 +0900
東京 武蔵野 小学校の校舎から男子中学生転落 意識不明の重体	html/20240801/k10014532741000.html	Thu, 01 Aug 2024 15:49:12 +0900
パリオリンピック予定 8/1～2（競技・放送・配信予定）	html/20240801/k10014532101000.html	Thu, 01 Aug 2024 07:47:50 +0900
卓球 早田ひな 女子シングルス 準決勝に進出 パリ五輪	html/20240802/k10014533591000.html	Fri, 02 Aug 2024 06:05:29 +0900
体操 男子個人総合 岡慎之助が金メダル パリ五輪【詳しく】	html/20240731/k10014531891000.html	Thu, 01 Aug 2024 05:56:56 +0900
柔道 男子100キロ級 ウルフアロン 敗者復活戦負け7位 パリ五輪	html/20240801/k10014532951000.html	Fri, 02 Aug 2024 01:22:20 +0900
卓球 男子シングルス 張本智和が準々決勝で敗退 パリ五輪	html/20240802/k10014533441000.html	Fri, 02 Aug 2024 05:51:49 +0900
“軽装で銀” トルコの射撃選手 SNSなどで話題に パリ五輪	html/20240802/k10014533721000.html	Fri, 02 Aug 2024 08:24:30 +0900
体操 岡慎之助 「日本の宝」大けが乗り越えつかんだ金メダル	html/20240801/k10014532311000.html	Thu, 01 Aug 2024 12:17:27 +0900
歌手 園まりさん死去 80歳「逢いたくて逢いたくて」など	html/20240801/k10014532411000.html	Thu, 01 Aug 2024 13:04:57 +0900
体操 内村航平さん “重圧なく楽しめていたのは岡選手だけ”	html/20240801/k10014532771000.html	Thu, 01 Aug 2024 17:48:42 +0900
パリオリンピック メダルランキング【7月31日】	html/20240801/k10014532181000.html	Thu, 01 Aug 2024 07:05:38 +0900
34都府県に熱中症警戒アラート 近畿は40度に迫る危険な暑さに	html/20240802/k10014533271000.html	Fri, 02 Aug 2024 06:04:52 +0900
ハマス最高幹部殺害 イラン最高指導者 報復行う考え示す	html/20240801/k10014531761000.html	Thu, 01 Aug 2024 06:45:32 +0900
マイナンバーカード 本物か見分けるアプリ開発 デジタル庁	html/20240801/k10014532351000.html	Thu, 01 Aug 2024 17:09:03 +0900
大手銀行 普通預金の金利 今の5倍に引き上げへ 追加利上げ受け	html/20240731/k10014531341000.html	Wed, 31 Jul 2024 20:38:05 +0900
