「H3」ロケット2号機 打ち上げ成功 前回の失敗乗り越える	html/20240216/k10014360921000.html	Sat, 17 Feb 2024 18:41:33 +0900
ロシア ナワリヌイ氏が死亡 プーチン政権批判の反体制派指導者	html/20240216/k10014361581000.html	Sat, 17 Feb 2024 23:05:13 +0900
食べられなかったおせち 見つからない重箱の3段目は…	html/20240217/k10014362031000.html	Sat, 17 Feb 2024 20:24:29 +0900
女性に性的暴行したとして逮捕・起訴 警察学校の警視正が死亡	html/20240218/k10014362491000.html	Sun, 18 Feb 2024 06:12:18 +0900
シニアの就活 ミスマッチはなぜ？	html/20240216/k10014359391000.html	Fri, 16 Feb 2024 18:09:14 +0900
ブレーキとアクセル 踏み間違い事故はなぜ起きるのか？	html/20240216/k10014361401000.html	Fri, 16 Feb 2024 19:21:59 +0900
岸田首相の偽画像などがSNSで相次ぎ拡散 注意を呼びかけ	html/20240218/k10014362371000.html	Sun, 18 Feb 2024 05:15:10 +0900
兄は“かまいたち” 特殊詐欺防ぐ名物店長【防止策を詳しく】	html/20240216/k10014356671000.html	Fri, 16 Feb 2024 12:13:48 +0900
被災地支援向かう宮崎県警のバス横転 中央分離帯に衝突か 広島	html/20240217/k10014361901000.html	Sat, 17 Feb 2024 18:10:48 +0900
SUBARU 勤務中の従業員の死亡事故で3工場の稼働停止	html/20240217/k10014361761000.html	Sat, 17 Feb 2024 07:39:13 +0900
ナワリヌイ氏死亡 広報担当者“殺害された” 各地で追悼の動き	html/20240218/k10014362511000.html	Sun, 18 Feb 2024 07:46:50 +0900
ウクライナ軍総司令官  東部アウディーイウカからの撤退を発表	html/20240217/k10014362221000.html	Sat, 17 Feb 2024 19:09:43 +0900
福山雅治さんもパレードに参加 長崎ランタンフェスティバル	html/20240217/k10014362121000.html	Sat, 17 Feb 2024 18:06:13 +0900
自民 小渕選対委員長 “政倫審の開催検討 国民から厳しい目”	html/20240217/k10014362071000.html	Sat, 17 Feb 2024 16:14:22 +0900
会社の学びに何を期待する？性教育やNPO活動も 企業の狙いは…	html/20240216/k10014340551000.html	Fri, 16 Feb 2024 20:33:26 +0900
400年ほど前の日本で作られた「書見台」ポルトガルで見つかる	html/20240218/k10014362331000.html	Sun, 18 Feb 2024 06:33:50 +0900
トランプ氏に532億円支払命令 企業の資産価値偽り不正に利益	html/20240217/k10014361931000.html	Sat, 17 Feb 2024 11:29:36 +0900
若い女性の支援団体に対する名誉毀損の疑い 40代男性書類送検	html/20240217/k10014361551000.html	Sat, 17 Feb 2024 07:40:51 +0900
石川 七尾 温浴施設が約1か月半ぶりに営業再開 無料開放	html/20240217/k10014362081000.html	Sat, 17 Feb 2024 16:16:47 +0900
【詳細】ロシア ウクライナに軍事侵攻（2月17日の動き）	html/20240217/k10014361791000.html	Sat, 17 Feb 2024 21:24:40 +0900
