伊藤詩織さんが謝罪 自身が監督の映画 一部差し替えへ	html/20250220/k10014728401000.html	Thu, 20 Feb 2025 18:26:51 +0900
岩手 大船渡 山林火災 住宅近くまで延焼するおそれ 避難指示も	html/20250221/k10014728861000.html	Fri, 21 Feb 2025 12:50:16 +0900
石川 顕著な大雪に関する情報 能登南部 交通障害に厳重警戒	html/20250221/k10014728911000.html	Fri, 21 Feb 2025 14:59:06 +0900
ヤクルト つば九郎 担当スタッフ死去 別れ惜しむ声相次ぐ	html/20250220/k10014728441000.html	Thu, 20 Feb 2025 19:05:54 +0900
所得税の非課税枠上乗せ “年収850万円以下に拡大” 公明案	html/20250221/k10014729321000.html	Fri, 21 Feb 2025 20:17:02 +0900
3連休も日本海側中心に大雪のおそれ 気象や交通の情報に注意	html/20250221/k10014728651000.html	Fri, 21 Feb 2025 20:26:33 +0900
【地震】山梨 神奈川で震度3	html/20250220/k10014728751000.html	Thu, 20 Feb 2025 22:20:12 +0900
トランプ政権がしびれを切らす？ 対応迫られるヨーロッパは	html/20250220/k10014728131000.html	Thu, 20 Feb 2025 18:31:21 +0900
トランプ大統領 就任1か月 大幅な方針転換 反発や懸念の声も	html/20250220/k10014727551000.html	Thu, 20 Feb 2025 19:31:04 +0900
大手ポンプメーカー 下請け法違反で公取委が勧告	html/20250220/k10014728391000.html	Thu, 20 Feb 2025 17:58:50 +0900
「自分の名前は桐島聡」 逃亡半世紀の果てに	html/20250220/k10014726711000.html	Thu, 20 Feb 2025 16:10:30 +0900
ヤクルト「つば九郎」担当スタッフが死去 活動しばらく休止へ	html/20250219/k10014727601000.html	Wed, 19 Feb 2025 22:00:44 +0900
トランプ大統領 ゼレンスキー大統領を「独裁者」欧は反発	html/20250220/k10014727561000.html	Thu, 20 Feb 2025 18:27:36 +0900
自公維 教育無償化の方向性 概ね確認 残る論点は社会保険料	html/20250220/k10014727681000.html	Thu, 20 Feb 2025 21:37:24 +0900
マイナンバーカード 有効期限に注意！更新しないとどうなる？	html/20250214/k10014722191000.html	Fri, 14 Feb 2025 13:16:00 +0900
プーチン大統領の思考を知る男が語る“トランプ交渉の危うさ”	html/20250221/k10014727841000.html	Fri, 21 Feb 2025 15:07:52 +0900
中国人約200人 ミャンマーの詐欺拠点からタイに移され保護へ	html/20250220/k10014727891000.html	Thu, 20 Feb 2025 19:30:17 +0900
東京の都立高校の入学試験行われる 平均倍率は過去最低に	html/20250221/k10014728991000.html	Fri, 21 Feb 2025 17:20:00 +0900
ゼレンスキー大統領と米特使 共同会見中止 首脳間の関係影響か	html/20250221/k10014728811000.html	Fri, 21 Feb 2025 07:50:04 +0900
ドジャース 山本由伸 オープン戦先発 大谷翔平は出場せず調整	html/20250221/k10014728701000.html	Fri, 21 Feb 2025 13:23:05 +0900
