大谷翔平 8号ソロホームランなど3安打 ドジャースは3連勝	html/20240505/k10014440841000.html	Sun, 05 May 2024 17:00:35 +0900
山形 南陽の山林火災 延焼続く ヘリコプター5機が上空から放水	html/20240505/k10014440701000.html	Sun, 05 May 2024 11:55:38 +0900
ドジャース 大谷翔平 今季初1試合2HR 4打数4安打 打率は.364に	html/20240506/k10014441281000.html	Mon, 06 May 2024 08:05:45 +0900
JR京都駅 列車内に不審物も危険性なし 一時運転見合わせ	html/20240505/k10014441091000.html	Sun, 05 May 2024 19:12:55 +0900
山形 南陽市の山林火災 3日目も延焼続く 自衛隊ヘリが消火活動	html/20240505/k10014441141000.html	Mon, 06 May 2024 07:00:43 +0900
劇作家で俳優の唐十郎さん死去 84歳 アングラ演劇で絶大な人気	html/20240505/k10014440761000.html	Sun, 05 May 2024 17:46:40 +0900
歴史学者・磯田道史 「歴史は韻をふむ」!?	html/20240504/k10014436761000.html	Sat, 04 May 2024 08:08:51 +0900
米投資家バフェット氏 日本の大手商社5社に投資“成長性評価”	html/20240505/k10014440921000.html	Sun, 05 May 2024 13:40:40 +0900
仙台 ホテルで高校生12人 腹痛など訴え搬送 食中毒の可能性も	html/20240505/k10014440781000.html	Sun, 05 May 2024 16:09:24 +0900
約100年前に制作 国産アニメーションのフィルム見つかる	html/20240505/k10014441071000.html	Sun, 05 May 2024 19:47:44 +0900
東京 銀座を走る高速道路 通行止めにして歩行者などに一時開放	html/20240504/k10014440511000.html	Sat, 04 May 2024 18:08:35 +0900
15歳未満の子どもは1401万人 43年連続の減少	html/20240504/k10014440231000.html	Sat, 04 May 2024 17:01:31 +0900
LINE情報漏えい 原因の韓国IT企業 関係見直し“私達が決める”	html/20240503/k10014439641000.html	Fri, 03 May 2024 14:53:04 +0900
イスラエルとハマスの戦闘休止交渉 詰めの協議か 依然不透明	html/20240505/k10014440721000.html	Sun, 05 May 2024 05:00:13 +0900
サッカー男子 U-23日本代表 パリ五輪アジア最終予選で優勝	html/20240504/k10014440141000.html	Sat, 04 May 2024 13:07:22 +0900
陸上 男子400mリレーと1600mリレー 日本 パリ五輪出場権獲得	html/20240505/k10014440831000.html	Sun, 05 May 2024 11:45:02 +0900
北海道 浦河町 山菜採りの81歳男性 クマに襲われ首などにけが	html/20240505/k10014440941000.html	Sun, 05 May 2024 17:58:35 +0900
米大統領選まで半年 バイデン大統領とトランプ氏が競り合う	html/20240505/k10014440661000.html	Sun, 05 May 2024 13:19:29 +0900
ピアニストのフジコ・ヘミングさん死去「奇蹟のカンパネラ」	html/20240502/k10014438441000.html	Thu, 02 May 2024 14:15:59 +0900
水槽の波は人力で!? …どうする、全国で“老いる”水族館	html/20240502/k10014437151000.html	Thu, 02 May 2024 16:35:14 +0900
