埼玉 八潮 道路陥没 転落男性救助のためスロープ作る工事開始	html/20250130/k10014707431000.html	Thu, 30 Jan 2025 22:02:55 +0900
ワシントン旅客機と米軍ヘリ衝突「生存者いるとは考えてない」	html/20250130/k10014707651000.html	Thu, 30 Jan 2025 23:23:26 +0900
【詳報】埼玉 八潮 道路陥没 トラック転落 救助活動難航経緯は	html/20250129/k10014706371000.html	Thu, 30 Jan 2025 00:05:34 +0900
政府 皇室典範改正勧告の国連委員会に異例の対応	html/20250129/k10014707141000.html	Wed, 29 Jan 2025 19:28:40 +0900
知らない間に50人の男が…実名で闘った女性の思い	html/20250129/k10014705941000.html	Wed, 29 Jan 2025 12:16:57 +0900
どんどん上がるコンセント？関西空港の目立たない大工事	html/20250129/k10014704441000.html	Wed, 29 Jan 2025 17:30:45 +0900
大阪 東大阪 山の中で発見の切断遺体 着衣なし 何者かが遺棄か	html/20250129/k10014707291000.html	Thu, 30 Jan 2025 12:25:24 +0900
東北や東日本の山沿い中心に あす明け方にかけ大雪の見通し	html/20250130/k10014707471000.html	Thu, 30 Jan 2025 20:34:36 +0900
フジテレビ 経営刷新へ小委員会設置「週刊文春」訂正に指摘も	html/20250130/k10014707581000.html	Thu, 30 Jan 2025 19:36:13 +0900
赤ちゃん殺害・遺棄なぜ相次ぐ？母親・父親たちの告白	html/20250130/k10014705751000.html	Thu, 30 Jan 2025 12:47:20 +0900
セブン＆アイHD 創業家側がタイ財閥大手に大規模出資を要請	html/20250130/k10014707901000.html	Thu, 30 Jan 2025 19:10:51 +0900
運転手に荷待ち強要か 大手物流会社に対し勧告行う方針 国交省	html/20250130/k10014707281000.html	Thu, 30 Jan 2025 06:01:55 +0900
森友学園めぐる文書の不開示の決定を取り消す判決 大阪高裁	html/20250130/k10014707811000.html	Thu, 30 Jan 2025 18:31:17 +0900
JR東海の「ドクターイエロー」 引退	html/20250129/k10014706721000.html	Wed, 29 Jan 2025 19:48:40 +0900
米FRB 利下げ見送り発表 去年7月以来 インフレ再加速を警戒か	html/20250130/k10014707381000.html	Thu, 30 Jan 2025 12:17:39 +0900
うその申し立てで凍結口座差し押さえ「支払い督促」利用される	html/20250130/k10014707301000.html	Thu, 30 Jan 2025 10:05:27 +0900
“ワクチン懐疑派”のケネディ・ジュニア氏「ワクチンは重要」	html/20250130/k10014707551000.html	Thu, 30 Jan 2025 10:23:24 +0900
フジテレビ清水社長 週刊文春の記事訂正“タイミングに疑問”	html/20250130/k10014708291000.html	Thu, 30 Jan 2025 21:31:02 +0900
岡山 JFEスチール西日本製鉄所の火災 ほぼ消し止められる	html/20250130/k10014707961000.html	Thu, 30 Jan 2025 18:32:32 +0900
フジテレビ10時間超会見 どう受け止められたのか？	html/20250128/k10014705571000.html	Tue, 28 Jan 2025 19:13:21 +0900
