俳優 イ・ソンギュンさん死亡「パラサイト 半地下の家族」出演	html/20231227/k10014301321000.html	Wed, 27 Dec 2023 19:29:52 +0900
餅がのどに詰まったらどうする？対処法と予防策は	html/20231227/k10014301041000.html	Wed, 27 Dec 2023 17:24:37 +0900
【詳しく】山本由伸 ドジャース入団会見 12年契約で合意	html/20231228/k10014301171000.html	Thu, 28 Dec 2023 14:07:47 +0900
大掃除ここが危ない 脚立正しく使えてる？掃除機から火災も…	html/20231227/k10014300961000.html	Wed, 27 Dec 2023 19:29:12 +0900
“百貨店ゼロ県”に… まもなく閉店「一畑百貨店」思い出は	html/20231227/k10014300491000.html	Wed, 27 Dec 2023 17:51:43 +0900
“仕事できなくなるのは死活問題” 不足する電線ケーブル	html/20231226/k10014300131000.html	Tue, 26 Dec 2023 17:00:03 +0900
松本人志さん週刊誌報道 吉本興業「当該事実は一切ない」	html/20231227/k10014301811000.html	Wed, 27 Dec 2023 19:18:58 +0900
不正輸出めぐるえん罪事件 捜査は違法 国と都に賠償命じる判決	html/20231227/k10014301301000.html	Wed, 27 Dec 2023 14:05:07 +0900
大谷翔平が語る2023 伝説と代償 そして新たな章へ	html/20231227/k10014300621000.html	Wed, 27 Dec 2023 18:55:24 +0900
柿沢前法務副大臣逮捕 江東区長選めぐる買収など疑い 東京地検	html/20231228/k10014302151000.html	Thu, 28 Dec 2023 17:10:22 +0900
2023年紅白歌合戦 出場歌手の曲順決まる 最後はMISIAさん	html/20231226/k10014291151000.html	Tue, 26 Dec 2023 13:41:15 +0900
高島屋「原因特定は不可能」 ケーキ崩れた状態で届いた問題	html/20231227/k10014301191000.html	Wed, 27 Dec 2023 13:49:38 +0900
高速道路のサービスエリア混雑対策 長時間駐車の有料化検討へ	html/20231227/k10014300971000.html	Wed, 27 Dec 2023 06:34:42 +0900
自民 大野泰正参院議員関係先 捜索開始 政治資金問題 東京地検	html/20231228/k10014302161000.html	Thu, 28 Dec 2023 17:06:42 +0900
宅配ボックスの謎 「空なのにロック」 いったい何が	html/20231226/k10014299891000.html	Tue, 26 Dec 2023 19:39:27 +0900
【動画更新】追悼 2023年に亡くなった方々	html/20231215/k10014279221000.html	Thu, 28 Dec 2023 16:45:59 +0900
トルコ大統領がイスラエル首相を非難“ヒトラーと変わらない”	html/20231228/k10014302061000.html	Thu, 28 Dec 2023 06:07:34 +0900
ウクライナ軍 東部拠点から撤退 南部で大型揚陸艦を破壊	html/20231227/k10014301111000.html	Wed, 27 Dec 2023 06:28:18 +0900
日銀 植田総裁 単独インタビュー 金融政策の転換は？	html/20231227/k10014301591000.html	Wed, 27 Dec 2023 19:23:53 +0900
自民 池田佳隆衆院議員の事務所捜索 政治資金問題 東京地検	html/20231227/k10014301151000.html	Wed, 27 Dec 2023 18:23:35 +0900
