【1分でわかる】日経平均株価 なぜ急上昇？ポイントを簡単解説	html/20240220/k10014364381000.html	Tue, 20 Feb 2024 19:04:07 +0900
JR線ケーブル切断 会社役員を逮捕 山陽本線で32本盗んだか	html/20240220/k10014365311000.html	Tue, 20 Feb 2024 20:15:18 +0900
俳優志望の女性に演技指導の名目で性的暴行か 映画監督を逮捕	html/20240220/k10014365521000.html	Tue, 20 Feb 2024 21:37:27 +0900
故意に税金未納や滞納繰り返した場合 国が永住許可取り消しへ	html/20240219/k10014364291000.html	Tue, 20 Feb 2024 06:17:01 +0900
浜名湖 高校生遺体事件 傷害や監禁疑い 17歳から21歳の5人逮捕	html/20240220/k10014365091000.html	Tue, 20 Feb 2024 19:53:06 +0900
アメリカが拒否権行使し否決 ガザ停戦決議案 国連安保理	html/20240221/k10014365741000.html	Wed, 21 Feb 2024 04:05:05 +0900
季節見失う暖かさ スキー場も農家も困惑 雪少なくても雪崩警戒	html/20240220/k10014364621000.html	Tue, 20 Feb 2024 19:00:49 +0900
「ひとりで移動できない」避難所で想像もしなかった苦労が	html/20240220/k10014363571000.html	Tue, 20 Feb 2024 16:57:07 +0900
東京ミネルヴァ法律事務所を除名 “預かり金25億円不正流用”	html/20240219/k10014364261000.html	Mon, 19 Feb 2024 21:13:54 +0900
文科省 旧統一教会を「指定宗教法人」に指定する方針固める	html/20240219/k10014364121000.html	Mon, 19 Feb 2024 20:33:38 +0900
40代でがんになった編集者の“生きた記録”	html/20240219/k10014360781000.html	Mon, 19 Feb 2024 15:54:38 +0900
サイバー攻撃犯罪集団「ロックビット」メンバーか 2人を検挙	html/20240221/k10014365611000.html	Wed, 21 Feb 2024 11:02:47 +0900
創設150年迎えた警視庁の歴史紹介 特別展 始まる 東京 中央区	html/20240220/k10014364731000.html	Tue, 20 Feb 2024 13:51:44 +0900
浜名湖 高校生遺体事件 友人宅でバイクを転倒させトラブルか	html/20240221/k10014365601000.html	Wed, 21 Feb 2024 05:16:37 +0900
地方自治法改正案まとまる“緊急時に国が自治体へ指示行える”	html/20240220/k10014364161000.html	Tue, 20 Feb 2024 07:06:44 +0900
自民 塩谷氏 武田氏が衆院政倫審に出席意向 野党側 “不十分”	html/20240220/k10014364791000.html	Tue, 20 Feb 2024 19:50:12 +0900
下校中の小学生3人が車にはねられけが 19歳運転手逮捕 静岡	html/20240220/k10014364931000.html	Tue, 20 Feb 2024 21:46:38 +0900
法政大アメフト部 大学の検査で3人の部員から大麻の陽性反応	html/20240220/k10014365661000.html	Tue, 20 Feb 2024 23:24:21 +0900
「徴用」めぐる裁判 原告側が企業の供託金を受領 韓国	html/20240220/k10014364781000.html	Tue, 20 Feb 2024 17:52:37 +0900
ナワリヌイ氏の母 プーチン大統領に遺体の引き渡し求める	html/20240221/k10014365771000.html	Wed, 21 Feb 2024 06:15:46 +0900
